ProductKey;ProductID;ProductName;Category;SubCategory
1;OFF-ST-4258;Fellowes File Cart, Industrial;Office Supplies;Storage
2;TEC-MA-4190;Epson Calculator, Red;Technology;Machines
3;FUR-BO-3647;Bush Stackable Bookrack, Pine;Furniture;Bookcases
4;OFF-FA-2945;Accos Paper Clips, Bulk Pack;Office Supplies;Fasteners
5;OFF-ST-6249;Tenex Folders, Blue;Office Supplies;Storage
6;OFF-SU-6166;Stiletto Letter Opener, High Speed;Office Supplies;Supplies
7;TEC-PH-5253;Motorola Headset, VoIP;Technology;Phones
8;OFF-ST-4078;Eldon Lockers, Blue;Office Supplies;Storage
9;OFF-AR-3463;BIC Pencil Sharpener, Water Color;Office Supplies;Art
10;OFF-ST-5693;Rogers File Cart, Single Width;Office Supplies;Storage
11;OFF-BI-3246;Avery Binder Covers, Clear;Office Supplies;Binders
12;OFF-BI-3249;Avery Binder Covers, Recycled;Office Supplies;Binders
13;OFF-LA-4638;Hon Color Coded Labels, Adjustable;Office Supplies;Labels
14;OFF-ST-5692;Rogers File Cart, Industrial;Office Supplies;Storage
15;FUR-CH-4547;Harbour Creations Rocking Chair, Set of Two;Furniture;Chairs
16;OFF-AR-6127;Stanley Sketch Pad, Fluorescent;Office Supplies;Art
17;TEC-PH-3818;Cisco Speaker Phone, with Caller ID;Technology;Phones
18;OFF-EN-4914;Jiffy Mailers, Recycled;Office Supplies;Envelopes
19;OFF-BI-6369;Wilson Jones 3-Hole Punch, Clear;Office Supplies;Binders
20;OFF-FA-6204;Stockwell Staples, Metal;Office Supplies;Fasteners
21;FUR-BO-5950;Sauder Classic Bookcase, Pine;Furniture;Bookcases
22;OFF-ST-6283;Tenex Trays, Single Width;Office Supplies;Storage
23;OFF-AR-5910;Sanford Highlighters, Blue;Office Supplies;Art
24;OFF-FA-6191;Stockwell Paper Clips, Metal;Office Supplies;Fasteners
25;FUR-FU-4066;Eldon Frame, Durable;Furniture;Furnishings
26;OFF-BI-3187;Avery 3-Hole Punch, Durable;Office Supplies;Binders
27;OFF-PA-5849;SanDisk Cards & Envelopes, Premium;Office Supplies;Paper
28;OFF-BI-4807;Ibico Binder Covers, Clear;Office Supplies;Binders
29;TEC-MA-5573;Panasonic Printer, White;Technology;Machines
30;OFF-AP-3864;Cuisinart Microwave, Black;Office Supplies;Appliances
31;TEC-CO-3587;Brother Copy Machine, Color;Technology;Copiers
32;FUR-FU-3951;Deflect-O Photo Frame, Duo Pack;Furniture;Furnishings
33;OFF-PA-3998;Eaton Message Books, 8.5 x 11;Office Supplies;Paper
34;OFF-FA-3053;Advantus Push Pins, 12 Pack;Office Supplies;Fasteners
35;FUR-CH-4630;Hon Chairmat, Adjustable;Furniture;Chairs
36;FUR-BO-5779;Safco Floating Shelf Set, Pine;Furniture;Bookcases
37;TEC-MA-4197;Epson Inkjet, Durable;Technology;Machines
38;OFF-ST-4081;Eldon Lockers, Wire Frame;Office Supplies;Storage
39;OFF-PA-5851;SanDisk Computer Printout Paper, 8.5 x 11;Office Supplies;Paper
40;OFF-FA-3046;Advantus Paper Clips, Metal;Office Supplies;Fasteners
41;OFF-LA-5388;Novimex Legal Exhibit Labels, Adjustable;Office Supplies;Labels
42;OFF-LA-5402;Novimex Shipping Labels, 5000 Label Set;Office Supplies;Labels
43;OFF-ST-6261;Tenex Lockers, Blue;Office Supplies;Storage
44;OFF-AP-4731;Hoover Microwave, Red;Office Supplies;Appliances
45;OFF-FA-6203;Stockwell Staples, Bulk Pack;Office Supplies;Fasteners
46;FUR-FU-3941;Deflect-O Frame, Duo Pack;Furniture;Furnishings
47;OFF-BI-3726;Cardinal Binding Machine, Economy;Office Supplies;Binders
48;TEC-MA-6136;StarTech Card Printer, Durable;Technology;Machines
49;OFF-PA-5854;SanDisk Computer Printout Paper, Recycled;Office Supplies;Paper
50;OFF-PA-5871;SanDisk Memo Slips, Recycled;Office Supplies;Paper
51;FUR-FU-6260;Tenex Light Bulb, Erganomic;Furniture;Furnishings
52;FUR-BO-3624;Bush Classic Bookcase, Metal;Furniture;Bookcases
53;OFF-PA-6600;Xerox Cards & Envelopes, 8.5 x 11;Office Supplies;Paper
54;TEC-MA-5503;Okidata Inkjet, Wireless;Technology;Machines
55;TEC-PH-3799;Cisco Office Telephone, with Caller ID;Technology;Phones
56;OFF-BI-2894;Acco Binder Covers, Recycled;Office Supplies;Binders
57;OFF-PA-6601;Xerox Cards & Envelopes, Multicolor;Office Supplies;Paper
58;OFF-ST-6274;Tenex Shelving, Single Width;Office Supplies;Storage
59;OFF-AP-3860;Cuisinart Coffee Grinder, Black;Office Supplies;Appliances
60;OFF-BI-3727;Cardinal Binding Machine, Recycled;Office Supplies;Binders
61;OFF-AR-6113;Stanley Highlighters, Water Color;Office Supplies;Art
62;OFF-ST-6065;Smead Trays, Blue;Office Supplies;Storage
63;TEC-CO-4770;HP Fax and Copier, Digital;Technology;Copiers
64;OFF-PA-5892;SanDisk Parchment Paper, Premium;Office Supplies;Paper
65;OFF-ST-6251;Tenex Folders, Single Width;Office Supplies;Storage
66;TEC-AC-5129;Logitech Mouse, USB;Technology;Accessories
67;FUR-BO-5953;Sauder Corner Shelving, Mobile;Furniture;Bookcases
68;OFF-BI-3186;Avery 3-Hole Punch, Clear;Office Supplies;Binders
69;OFF-FA-6184;Stockwell Clamps, 12 Pack;Office Supplies;Fasteners
70;FUR-TA-3353;Barricks Training Table, Fully Assembled;Furniture;Tables
71;OFF-AR-3449;BIC Canvas, Fluorescent;Office Supplies;Art
72;OFF-LA-3323;Avery Shipping Labels, Laser Printer Compatible;Office Supplies;Labels
73;OFF-ST-6228;Tenex Box, Blue;Office Supplies;Storage
74;OFF-AR-6123;Stanley Pens, Fluorescent;Office Supplies;Art
75;TEC-MA-4209;Epson Receipt Printer, Durable;Technology;Machines
76;OFF-FA-6195;Stockwell Push Pins, Bulk Pack;Office Supplies;Fasteners
77;OFF-ST-6040;Smead Folders, Single Width;Office Supplies;Storage
78;FUR-CH-4521;Harbour Creations Bag Chairs, Set of Two;Furniture;Chairs
79;TEC-CO-3593;Brother Fax and Copier, High-Speed;Technology;Copiers
80;OFF-EN-4908;Jiffy Clasp Envelope, Set of 50;Office Supplies;Envelopes
81;TEC-CO-4577;Hewlett Fax Machine, High-Speed;Technology;Copiers
82;OFF-AR-5918;Sanford Markers, Easy-Erase;Office Supplies;Art
83;OFF-AP-4951;KitchenAid Blender, White;Office Supplies;Appliances
84;OFF-ST-6041;Smead Folders, Wire Frame;Office Supplies;Storage
85;OFF-PA-4483;Green Bar Parchment Paper, Premium;Office Supplies;Paper
86;OFF-FA-6198;Stockwell Rubber Bands, Assorted Sizes;Office Supplies;Fasteners
87;OFF-AP-4721;Hoover Blender, White;Office Supplies;Appliances
88;OFF-FA-6199;Stockwell Rubber Bands, Bulk Pack;Office Supplies;Fasteners
89;FUR-BO-3901;Dania Library with Doors, Metal;Furniture;Bookcases
90;TEC-PH-5815;Samsung Audio Dock, with Caller ID;Technology;Phones
91;OFF-BI-2882;Acco 3-Hole Punch, Durable;Office Supplies;Binders
92;OFF-AR-3552;Boston Sketch Pad, Blue;Office Supplies;Art
93;OFF-BI-4804;Ibico 3-Hole Punch, Durable;Office Supplies;Binders
94;OFF-EN-4432;GlobeWeis Business Envelopes, Security-Tint;Office Supplies;Envelopes
95;OFF-BI-3251;Avery Binder, Clear;Office Supplies;Binders
96;OFF-AR-6122;Stanley Pens, Easy-Erase;Office Supplies;Art
97;OFF-SU-4993;Kleencut Trimmer, Easy Grip;Office Supplies;Supplies
98;OFF-AR-3545;Boston Pencil Sharpener, Water Color;Office Supplies;Art
99;OFF-FA-6207;Stockwell Thumb Tacks, Bulk Pack;Office Supplies;Fasteners
100;FUR-BO-5952;Sauder Corner Shelving, Metal;Furniture;Bookcases
101;TEC-AC-3388;Belkin Memory Card, Bluetooth;Technology;Accessories
102;OFF-ST-5711;Rogers Trays, Single Width;Office Supplies;Storage
103;OFF-PA-4000;Eaton Message Books, Premium;Office Supplies;Paper
104;OFF-ST-6272;Tenex Shelving, Blue;Office Supplies;Storage
105;OFF-AR-6126;Stanley Sketch Pad, Easy-Erase;Office Supplies;Art
106;TEC-MA-4205;Epson Printer, Durable;Technology;Machines
107;OFF-FA-6197;Stockwell Rubber Bands, 12 Pack;Office Supplies;Fasteners
108;OFF-PA-6605;Xerox Computer Printout Paper, 8.5 x 11;Office Supplies;Paper
109;OFF-LA-6054;Smead Round Labels, Adjustable;Office Supplies;Labels
110;TEC-AC-5223;Memorex Router, Bluetooth;Technology;Accessories
111;OFF-ST-4063;Eldon Folders, Wire Frame;Office Supplies;Storage
112;TEC-AC-5887;SanDisk Numeric Keypad, Bluetooth;Technology;Accessories
113;FUR-BO-5951;Sauder Classic Bookcase, Traditional;Furniture;Bookcases
114;OFF-BI-2914;Acco Hole Reinforcements, Economy;Office Supplies;Binders
115;OFF-BI-3736;Cardinal Hole Reinforcements, Recycled;Office Supplies;Binders
116;TEC-PH-5356;Nokia Smart Phone, with Caller ID;Technology;Phones
117;FUR-FU-4065;Eldon Frame, Duo Pack;Furniture;Furnishings
118;FUR-BO-5955;Sauder Corner Shelving, Traditional;Furniture;Bookcases
119;OFF-AR-3499;Binney & Smith Sketch Pad, Blue;Office Supplies;Art
120;OFF-LA-4657;Hon File Folder Labels, 5000 Label Set;Office Supplies;Labels
121;OFF-SU-6172;Stiletto Scissors, Easy Grip;Office Supplies;Supplies
122;OFF-ST-6248;Tenex File Cart, Single Width;Office Supplies;Storage
123;OFF-EN-4912;Jiffy Interoffice Envelope, Set of 50;Office Supplies;Envelopes
124;OFF-ST-4263;Fellowes Folders, Single Width;Office Supplies;Storage
125;OFF-AR-3555;Boston Sketch Pad, Water Color;Office Supplies;Art
126;TEC-AC-5883;SanDisk Mouse, USB;Technology;Accessories
127;OFF-FA-6190;Stockwell Paper Clips, Bulk Pack;Office Supplies;Fasteners
128;OFF-AR-6125;Stanley Sketch Pad, Blue;Office Supplies;Art
129;OFF-BI-6400;Wilson Jones Hole Reinforcements, Recycled;Office Supplies;Binders
130;OFF-EN-4452;GlobeWeis Peel and Seal, Security-Tint;Office Supplies;Envelopes
131;TEC-PH-3135;Apple Headset, with Caller ID;Technology;Phones
132;OFF-FA-3070;Advantus Staples, Bulk Pack;Office Supplies;Fasteners
133;OFF-ST-5696;Rogers Folders, Single Width;Office Supplies;Storage
134;OFF-ST-5689;Rogers Box, Wire Frame;Office Supplies;Storage
135;TEC-CO-5990;Sharp Copy Machine, Color;Technology;Copiers
136;OFF-BI-4814;Ibico Binder, Recycled;Office Supplies;Binders
137;TEC-AC-5123;Logitech Memory Card, Programmable;Technology;Accessories
138;TEC-PH-5346;Nokia Office Telephone, Cordless;Technology;Phones
139;TEC-AC-5219;Memorex Mouse, USB;Technology;Accessories
140;OFF-PA-4467;Green Bar Computer Printout Paper, Multicolor;Office Supplies;Paper
141;OFF-ST-4250;Fellowes Box, Blue;Office Supplies;Storage
142;OFF-BI-3254;Avery Binder, Recycled;Office Supplies;Binders
143;OFF-AP-4963;KitchenAid Refrigerator, White;Office Supplies;Appliances
144;FUR-CH-5395;Novimex Rocking Chair, Black;Furniture;Chairs
145;OFF-BI-6374;Wilson Jones Binder Covers, Clear;Office Supplies;Binders
146;FUR-FU-3949;Deflect-O Light Bulb, Erganomic;Furniture;Furnishings
147;OFF-ST-6023;Smead Box, Blue;Office Supplies;Storage
148;FUR-FU-5729;Rubbermaid Frame, Durable;Furniture;Furnishings
149;TEC-PH-3803;Cisco Signal Booster, with Caller ID;Technology;Phones
150;OFF-EN-3103;Ames Mailers, with clear poly window;Office Supplies;Envelopes
151;OFF-EN-5024;Kraft Business Envelopes, Set of 50;Office Supplies;Envelopes
152;OFF-PA-3994;Eaton Memo Slips, 8.5 x 11;Office Supplies;Paper
153;TEC-MA-5578;Panasonic Receipt Printer, Wireless;Technology;Machines
154;OFF-ST-4293;Fellowes Trays, Blue;Office Supplies;Storage
155;FUR-BO-4846;Ikea 3-Shelf Cabinet, Pine;Furniture;Bookcases
156;OFF-AR-6105;Stanley Canvas, Blue;Office Supplies;Art
157;OFF-PA-5884;SanDisk Note Cards, 8.5 x 11;Office Supplies;Paper
158;TEC-MA-6144;StarTech Phone, Red;Technology;Machines
159;OFF-AR-6118;Stanley Pencil Sharpener, Easy-Erase;Office Supplies;Art
160;OFF-AR-5926;Sanford Pens, Fluorescent;Office Supplies;Art
161;OFF-ST-4264;Fellowes Folders, Wire Frame;Office Supplies;Storage
162;OFF-LA-3315;Avery Round Labels, Adjustable;Office Supplies;Labels
163;OFF-ST-6230;Tenex Box, Single Width;Office Supplies;Storage
164;FUR-CH-4628;Hon Bag Chairs, Red;Furniture;Chairs
165;OFF-EN-3668;Cameo Mailers, with clear poly window;Office Supplies;Envelopes
166;OFF-SU-6177;Stiletto Shears, High Speed;Office Supplies;Supplies
167;OFF-EN-3654;Cameo Business Envelopes, Recycled;Office Supplies;Envelopes
168;FUR-FU-5725;Rubbermaid Door Stop, Durable;Furniture;Furnishings
169;OFF-LA-4526;Harbour Creations Color Coded Labels, 5000 Label Set;Office Supplies;Labels
170;OFF-BI-6378;Wilson Jones Binder, Clear;Office Supplies;Binders
171;OFF-ST-4260;Fellowes File Cart, Wire Frame;Office Supplies;Storage
172;OFF-AR-6120;Stanley Pencil Sharpener, Water Color;Office Supplies;Art
173;OFF-AR-5925;Sanford Pens, Easy-Erase;Office Supplies;Art
174;OFF-BI-3292;Avery Hole Reinforcements, Recycled;Office Supplies;Binders
175;OFF-AP-3575;Breville Refrigerator, Red;Office Supplies;Appliances
176;OFF-AR-3554;Boston Sketch Pad, Fluorescent;Office Supplies;Art
177;FUR-BO-5971;Sauder Stackable Bookrack, Mobile;Furniture;Bookcases
178;OFF-ST-6275;Tenex Shelving, Wire Frame;Office Supplies;Storage
179;OFF-AR-6117;Stanley Markers, Water Color;Office Supplies;Art
180;FUR-CH-5794;SAFCO Rocking Chair, Black;Furniture;Chairs
181;TEC-CO-5999;Sharp Fax Machine, High-Speed;Technology;Copiers
182;OFF-SU-4320;Fiskars Shears, High Speed;Office Supplies;Supplies
183;OFF-SU-4982;Kleencut Ruler, High Speed;Office Supplies;Supplies
184;OFF-EN-3108;Ames Peel and Seal, Recycled;Office Supplies;Envelopes
185;OFF-BI-2900;Acco Binding Machine, Durable;Office Supplies;Binders
186;TEC-PH-5357;Nokia Speaker Phone, Cordless;Technology;Phones
187;TEC-CO-3611;Brother Wireless Fax, Laser;Technology;Copiers
188;OFF-AP-4749;Hoover Toaster, White;Office Supplies;Appliances
189;OFF-AR-3548;Boston Pens, Fluorescent;Office Supplies;Art
190;OFF-AR-3537;Boston Markers, Blue;Office Supplies;Art
191;OFF-AR-6111;Stanley Highlighters, Easy-Erase;Office Supplies;Art
192;OFF-BI-3733;Cardinal Hole Reinforcements, Clear;Office Supplies;Binders
193;OFF-AR-3493;Binney & Smith Pencil Sharpener, Fluorescent;Office Supplies;Art
194;OFF-ST-6252;Tenex Folders, Wire Frame;Office Supplies;Storage
195;OFF-AR-5904;Sanford Canvas, Fluorescent;Office Supplies;Art
196;OFF-BI-4826;Ibico Hole Reinforcements, Recycled;Office Supplies;Binders
197;TEC-MA-6132;StarTech Calculator, Durable;Technology;Machines
198;OFF-BI-6385;Wilson Jones Binding Machine, Recycled;Office Supplies;Binders
199;OFF-ST-5687;Rogers Box, Industrial;Office Supplies;Storage
200;TEC-PH-5836;Samsung Signal Booster, Full Size;Technology;Phones
201;FUR-CH-4654;Hon Executive Leather Armchair, Adjustable;Furniture;Chairs
202;TEC-AC-5132;Logitech Numeric Keypad, Programmable;Technology;Accessories
203;OFF-EN-3107;Ames Manila Envelope, with clear poly window;Office Supplies;Envelopes
204;OFF-BI-6375;Wilson Jones Binder Covers, Durable;Office Supplies;Binders
205;OFF-AR-3497;Binney & Smith Pens, Fluorescent;Office Supplies;Art
206;TEC-AC-5895;SanDisk Router, Erganomic;Technology;Accessories
207;TEC-PH-3815;Cisco Speaker Phone, Cordless;Technology;Phones
208;OFF-BI-3738;Cardinal Index Tab, Durable;Office Supplies;Binders
209;OFF-BI-2919;Acco Index Tab, Economy;Office Supplies;Binders
210;FUR-TA-3358;Barricks Wood Table, Rectangular;Furniture;Tables
211;TEC-MA-5001;Konica Calculator, Wireless;Technology;Machines
212;OFF-PA-4006;Eaton Parchment Paper, Multicolor;Office Supplies;Paper
213;OFF-SU-6182;Stiletto Trimmer, Serrated;Office Supplies;Supplies
214;FUR-FU-3933;Deflect-O Door Stop, Duo Pack;Furniture;Furnishings
215;OFF-SU-6179;Stiletto Shears, Steel;Office Supplies;Supplies
216;FUR-CH-4629;Hon Bag Chairs, Set of Two;Furniture;Chairs
217;OFF-FA-6185;Stockwell Clamps, Assorted Sizes;Office Supplies;Fasteners
218;OFF-AR-3543;Boston Pencil Sharpener, Easy-Erase;Office Supplies;Art
219;FUR-FU-6271;Tenex Photo Frame, Erganomic;Furniture;Furnishings
220;OFF-LA-5398;Novimex Round Labels, 5000 Label Set;Office Supplies;Labels
221;OFF-ST-6246;Tenex File Cart, Blue;Office Supplies;Storage
222;OFF-AR-3526;Boston Canvas, Easy-Erase;Office Supplies;Art
223;OFF-ST-5697;Rogers Folders, Wire Frame;Office Supplies;Storage
224;OFF-AR-3481;Binney & Smith Highlighters, Blue;Office Supplies;Art
225;OFF-BI-3189;Avery 3-Hole Punch, Recycled;Office Supplies;Binders
226;OFF-LA-4554;Harbour Creations Shipping Labels, Alphabetical;Office Supplies;Labels
227;TEC-MA-6138;StarTech Card Printer, White;Technology;Machines
228;FUR-FU-4084;Eldon Photo Frame, Duo Pack;Furniture;Furnishings
229;FUR-BO-3626;Bush Classic Bookcase, Pine;Furniture;Bookcases
230;FUR-BO-3903;Dania Library with Doors, Pine;Furniture;Bookcases
231;OFF-BI-6404;Wilson Jones Index Tab, Economy;Office Supplies;Binders
232;TEC-PH-3787;Cisco Audio Dock, with Caller ID;Technology;Phones
233;TEC-MA-5508;Okidata Phone, White;Technology;Machines
234;OFF-AR-3544;Boston Pencil Sharpener, Fluorescent;Office Supplies;Art
235;OFF-ST-4253;Fellowes Box, Wire Frame;Office Supplies;Storage
236;FUR-CH-5450;Office Star Steel Folding Chair, Adjustable;Furniture;Chairs
237;FUR-FU-3029;Advantus Door Stop, Durable;Furniture;Furnishings
238;OFF-PA-4001;Eaton Message Books, Recycled;Office Supplies;Paper
239;OFF-ST-6031;Smead File Cart, Blue;Office Supplies;Storage
240;OFF-FA-2952;Accos Rubber Bands, Assorted Sizes;Office Supplies;Fasteners
241;TEC-AC-5226;Memorex Router, USB;Technology;Accessories
242;TEC-AC-5873;SanDisk Memory Card, Erganomic;Technology;Accessories
243;OFF-ST-4269;Fellowes Lockers, Wire Frame;Office Supplies;Storage
244;TEC-AC-5100;Logitech Flash Drive, Erganomic;Technology;Accessories
245;FUR-BO-4850;Ikea Classic Bookcase, Pine;Furniture;Bookcases
246;TEC-MA-5018;Konica Receipt Printer, Durable;Technology;Machines
247;TEC-PH-5266;Motorola Signal Booster, with Caller ID;Technology;Phones
248;OFF-EN-4449;GlobeWeis Manila Envelope, Set of 50;Office Supplies;Envelopes
249;FUR-BO-3627;Bush Classic Bookcase, Traditional;Furniture;Bookcases
250;OFF-ST-6067;Smead Trays, Single Width;Office Supplies;Storage
251;OFF-ST-4107;Eldon Trays, Single Width;Office Supplies;Storage
252;OFF-AR-3451;BIC Highlighters, Blue;Office Supplies;Art
253;OFF-LA-3273;Avery File Folder Labels, Alphabetical;Office Supplies;Labels
254;FUR-FU-3037;Advantus Light Bulb, Duo Pack;Furniture;Furnishings
255;OFF-ST-5694;Rogers Folders, Blue;Office Supplies;Storage
256;OFF-AP-3859;Cuisinart Blender, White;Office Supplies;Appliances
257;OFF-AR-3465;BIC Pens, Easy-Erase;Office Supplies;Art
258;OFF-LA-4548;Harbour Creations Round Labels, 5000 Label Set;Office Supplies;Labels
259;OFF-BI-6399;Wilson Jones Hole Reinforcements, Economy;Office Supplies;Binders
260;OFF-ST-4057;Eldon File Cart, Single Width;Office Supplies;Storage
261;OFF-AR-6121;Stanley Pens, Blue;Office Supplies;Art
262;OFF-SU-4123;Elite Ruler, Easy Grip;Office Supplies;Supplies
263;TEC-AC-4171;Enermax Mouse, Bluetooth;Technology;Accessories
264;OFF-EN-5029;Kraft Interoffice Envelope, Recycled;Office Supplies;Envelopes
265;OFF-LA-4640;Hon Color Coded Labels, Laser Printer Compatible;Office Supplies;Labels
266;TEC-CO-4774;HP Fax Machine, Digital;Technology;Copiers
267;OFF-BI-2893;Acco Binder Covers, Economy;Office Supplies;Binders
268;TEC-CO-3602;Brother Ink, Laser;Technology;Copiers
269;OFF-FA-6202;Stockwell Staples, Assorted Sizes;Office Supplies;Fasteners
270;FUR-BO-3897;Dania Floating Shelf Set, Metal;Furniture;Bookcases
271;OFF-AR-6110;Stanley Highlighters, Blue;Office Supplies;Art
272;TEC-CO-5992;Sharp Copy Machine, Laser;Technology;Copiers
273;OFF-ST-4266;Fellowes Lockers, Blue;Office Supplies;Storage
274;TEC-PH-5842;Samsung Smart Phone, with Caller ID;Technology;Phones
275;FUR-FU-3049;Advantus Photo Frame, Durable;Furniture;Furnishings
276;OFF-AP-3877;Cuisinart Toaster, Red;Office Supplies;Appliances
277;OFF-BI-4816;Ibico Binding Machine, Durable;Office Supplies;Binders
278;FUR-FU-3934;Deflect-O Door Stop, Durable;Furniture;Furnishings
279;FUR-FU-3929;Deflect-O Clock, Duo Pack;Furniture;Furnishings
280;TEC-PH-3130;Apple Audio Dock, with Caller ID;Technology;Phones
281;FUR-BO-5943;Sauder 3-Shelf Cabinet, Traditional;Furniture;Bookcases
282;OFF-EN-5033;Kraft Mailers, Recycled;Office Supplies;Envelopes
283;OFF-FA-5467;OIC Paper Clips, 12 Pack;Office Supplies;Fasteners
284;OFF-LA-4665;Hon Legal Exhibit Labels, Laser Printer Compatible;Office Supplies;Labels
285;OFF-AR-6116;Stanley Markers, Fluorescent;Office Supplies;Art
286;FUR-FU-3930;Deflect-O Clock, Durable;Furniture;Furnishings
287;TEC-PH-3785;Cisco Audio Dock, Full Size;Technology;Phones
288;TEC-PH-3152;Apple Speaker Phone, VoIP;Technology;Phones
289;OFF-PA-3986;Eaton Cards & Envelopes, 8.5 x 11;Office Supplies;Paper
290;OFF-ST-4106;Eldon Trays, Industrial;Office Supplies;Storage
291;OFF-FA-6189;Stockwell Paper Clips, Assorted Sizes;Office Supplies;Fasteners
292;FUR-CH-5457;Office Star Swivel Stool, Set of Two;Furniture;Chairs
293;TEC-PH-5248;Motorola Audio Dock, VoIP;Technology;Phones
294;OFF-EN-3097;Ames Interoffice Envelope, Security-Tint;Office Supplies;Envelopes
295;OFF-SU-6174;Stiletto Scissors, Serrated;Office Supplies;Supplies
296;OFF-BI-4805;Ibico 3-Hole Punch, Economy;Office Supplies;Binders
297;OFF-FA-2959;Accos Thumb Tacks, 12 Pack;Office Supplies;Fasteners
298;FUR-CH-5366;Novimex Bag Chairs, Adjustable;Furniture;Chairs
299;OFF-EN-3094;Ames Clasp Envelope, with clear poly window;Office Supplies;Envelopes
300;OFF-ST-5701;Rogers Lockers, Industrial;Office Supplies;Storage
301;OFF-ST-5710;Rogers Trays, Industrial;Office Supplies;Storage
302;FUR-FU-4035;Eldon Clock, Duo Pack;Furniture;Furnishings
303;OFF-ST-5703;Rogers Lockers, Wire Frame;Office Supplies;Storage
304;FUR-BO-5941;Sauder 3-Shelf Cabinet, Mobile;Furniture;Bookcases
305;TEC-PH-3806;Cisco Smart Phone, Full Size;Technology;Phones
306;OFF-FA-5481;OIC Staples, Assorted Sizes;Office Supplies;Fasteners
307;OFF-FA-5487;OIC Thumb Tacks, Metal;Office Supplies;Fasteners
308;OFF-LA-4679;Hon Removable Labels, Adjustable;Office Supplies;Labels
309;OFF-AR-6124;Stanley Pens, Water Color;Office Supplies;Art
310;OFF-EN-5041;Kraft Peel and Seal, Recycled;Office Supplies;Envelopes
311;FUR-FU-5734;Rubbermaid Light Bulb, Erganomic;Furniture;Furnishings
312;OFF-AR-5923;Sanford Pencil Sharpener, Water Color;Office Supplies;Art
313;FUR-TA-3769;Chromcraft Round Table, Adjustable Height;Furniture;Tables
314;TEC-MA-4194;Epson Card Printer, Red;Technology;Machines
315;TEC-AC-5206;Memorex Memory Card, USB;Technology;Accessories
316;TEC-MA-5000;Konica Calculator, White;Technology;Machines
317;OFF-BI-3294;Avery Index Tab, Durable;Office Supplies;Binders
318;OFF-PA-4471;Green Bar Memo Slips, Multicolor;Office Supplies;Paper
319;OFF-BI-2917;Acco Index Tab, Clear;Office Supplies;Binders
320;OFF-ST-4259;Fellowes File Cart, Single Width;Office Supplies;Storage
321;OFF-SU-4322;Fiskars Shears, Steel;Office Supplies;Supplies
322;OFF-ST-6057;Smead Shelving, Blue;Office Supplies;Storage
323;FUR-FU-3025;Advantus Clock, Durable;Furniture;Furnishings
324;OFF-PA-5868;SanDisk Memo Slips, 8.5 x 11;Office Supplies;Paper
325;OFF-SU-4981;Kleencut Ruler, Easy Grip;Office Supplies;Supplies
326;OFF-EN-3105;Ames Manila Envelope, Security-Tint;Office Supplies;Envelopes
327;OFF-ST-6047;Smead Lockers, Industrial;Office Supplies;Storage
328;FUR-TA-4634;Hon Coffee Table, Adjustable Height;Furniture;Tables
329;OFF-ST-6231;Tenex Box, Wire Frame;Office Supplies;Storage
330;FUR-CH-4564;Harbour Creations Swivel Stool, Set of Two;Furniture;Chairs
331;OFF-ST-6060;Smead Shelving, Wire Frame;Office Supplies;Storage
332;OFF-BI-3737;Cardinal Index Tab, Clear;Office Supplies;Binders
333;OFF-BI-6372;Wilson Jones 3-Hole Punch, Recycled;Office Supplies;Binders
334;FUR-TA-4646;Hon Conference Table, Fully Assembled;Furniture;Tables
335;FUR-FU-5728;Rubbermaid Frame, Duo Pack;Furniture;Furnishings
336;OFF-EN-5025;Kraft Clasp Envelope, Recycled;Office Supplies;Envelopes
337;OFF-AR-5911;Sanford Highlighters, Easy-Erase;Office Supplies;Art
338;TEC-PH-5359;Nokia Speaker Phone, VoIP;Technology;Phones
339;FUR-CH-4698;Hon Steel Folding Chair, Black;Furniture;Chairs
340;OFF-ST-5688;Rogers Box, Single Width;Office Supplies;Storage
341;OFF-AP-4738;Hoover Refrigerator, White;Office Supplies;Appliances
342;FUR-CH-5796;SAFCO Rocking Chair, Set of Two;Furniture;Chairs
343;TEC-AC-3394;Belkin Mouse, Programmable;Technology;Accessories
344;TEC-PH-5337;Nokia Audio Dock, VoIP;Technology;Phones
345;FUR-BO-3898;Dania Floating Shelf Set, Mobile;Furniture;Bookcases
346;TEC-AC-3391;Belkin Memory Card, USB;Technology;Accessories
347;OFF-BI-4808;Ibico Binder Covers, Durable;Office Supplies;Binders
348;TEC-AC-3385;Belkin Keyboard, Erganomic;Technology;Accessories
349;OFF-AR-3466;BIC Pens, Fluorescent;Office Supplies;Art
350;OFF-ST-6059;Smead Shelving, Single Width;Office Supplies;Storage
351;OFF-LA-6051;Smead Removable Labels, Adjustable;Office Supplies;Labels
352;TEC-CO-4769;HP Fax and Copier, Color;Technology;Copiers
353;OFF-AR-3461;BIC Pencil Sharpener, Easy-Erase;Office Supplies;Art
354;OFF-EN-4438;GlobeWeis Clasp Envelope, with clear poly window;Office Supplies;Envelopes
355;OFF-AR-3553;Boston Sketch Pad, Easy-Erase;Office Supplies;Art
356;FUR-FU-5740;Rubbermaid Stacking Tray, Durable;Furniture;Furnishings
357;OFF-FA-3044;Advantus Paper Clips, Assorted Sizes;Office Supplies;Fasteners
358;OFF-BI-3255;Avery Binding Machine, Clear;Office Supplies;Binders
359;OFF-AR-5933;Sanford Sketch Pad, Water Color;Office Supplies;Art
360;TEC-MA-5013;Konica Phone, Wireless;Technology;Machines
361;OFF-BI-4817;Ibico Binding Machine, Economy;Office Supplies;Binders
362;OFF-SU-4126;Elite Ruler, Steel;Office Supplies;Supplies
363;TEC-PH-3151;Apple Speaker Phone, Full Size;Technology;Phones
364;OFF-AP-4733;Hoover Microwave, White;Office Supplies;Appliances
365;OFF-AR-6119;Stanley Pencil Sharpener, Fluorescent;Office Supplies;Art
366;TEC-AC-4186;Enermax Router, Erganomic;Technology;Accessories
367;OFF-AR-3547;Boston Pens, Easy-Erase;Office Supplies;Art
368;FUR-CH-4546;Harbour Creations Rocking Chair, Red;Furniture;Chairs
369;OFF-LA-4551;Harbour Creations Round Labels, Laser Printer Compatible;Office Supplies;Labels
370;OFF-BI-3247;Avery Binder Covers, Durable;Office Supplies;Binders
371;TEC-MA-5539;Panasonic Calculator, Red;Technology;Machines
372;OFF-PA-5893;SanDisk Parchment Paper, Recycled;Office Supplies;Paper
373;FUR-CH-5758;SAFCO Chairmat, Red;Furniture;Chairs
374;FUR-CH-5808;SAFCO Swivel Stool, Set of Two;Furniture;Chairs
375;TEC-MA-5501;Okidata Inkjet, Durable;Technology;Machines
376;OFF-FA-3073;Advantus Thumb Tacks, Assorted Sizes;Office Supplies;Fasteners
377;FUR-FU-3030;Advantus Door Stop, Erganomic;Furniture;Furnishings
378;OFF-ST-6066;Smead Trays, Industrial;Office Supplies;Storage
379;TEC-AC-5124;Logitech Memory Card, USB;Technology;Accessories
380;OFF-AP-4510;Hamilton Beach Toaster, Red;Office Supplies;Appliances
381;OFF-EN-5034;Kraft Mailers, Security-Tint;Office Supplies;Envelopes
